{
    "@context": "https://standards-ontotest.oftrust.net/v2/Context/Identity/Event/",
    "@type": "Event",
    "@id": "",
    "data": {
        "endDateTime": "",
        "duration": "",
        "categorizationLocal": "",
        "name": "",
        "startDateTime": "",
        "descriptionGeneral": "",
        "url": ""
    },
    "metadata": {
        "updatedBy": "",
        "createdAt": "",
        "updatedAt": "",
        "createdBy": ""
    },
    "locationName": ""
}